{
  "schema_version": "1.0",
  "type": "update_target",
  "tenant_id": "00000000-0000-0000-0000-000000000001",
  "site_id": "00000000-0000-0000-0000-000000000002",
  "device_id": "00000000-0000-0000-0000-000000000003",
  "release": "edge-2026.08.0",
  "release_seq": 12,
  "rollout_id": "7a1f0c22-4c5e-4a1a-9f0b-2c3d4e5f6a7b",
  "assigned_at": "2026-08-05T08:15:00Z",
  "manifest_b64": "ewogICJzY2hlbWFfdmVyc2lvbiI6ICIxLjAiLAogICJyZWxlYXNlIjogImVkZ2UtMjAyNi4wOC4wIiwKICAicmVsZWFzZV9zZXEiOiAxMiwKICAidGFyZ2V0X2NvbW1pdCI6ICIzYmY4YzAzOGExYjIiLAogICJhcnRpZmFjdHMiOiBbCiAgICB7CiAgICAgICJ0eXBlIjogIm9jaS1pbWFnZSIsCiAgICAgICJuYW1lIjogImNvcmUiLAogICAgICAicmVmIjogImdpdC50ZWNtYXh4LmRlL21hbW90ZWMvdm9sdHBpbG90LWVtcy9lZGdlLWFwcC1jb3JlQHNoYTI1NjoxMTExMTExMTExMTExMTExMTExMTExMTExMTExMTExMTExMTExMTExMTExMTExMTExMTExMTExMTExMTExMTExIgogICAgfSwKICAgIHsKICAgICAgInR5cGUiOiAib2NpLWltYWdlIiwKICAgICAgIm5hbWUiOiAibm9kZXJlZCIsCiAgICAgICJyZWYiOiAiZ2l0LnRlY21heHguZGUvbWFtb3RlYy92b2x0cGlsb3QtZW1zL2VkZ2UtYXBwLW5vZGVyZWRAc2hhMjU2OjIyMjIyMjIyMjIyMjIyMjIyMjIyMjIyMjIyMjIyMjIyMjIyMjIyMjIyMjIyMjIyMjIyMjIyMjIyMjIyMjIyMjIiCiAgICB9CiAgXSwKICAibWluX2Zyb21fc2VxIjogOSwKICAiYWxsb3dfZG93bmdyYWRlIjogZmFsc2UsCiAgInZhbGlkX3VudGlsIjogIjIwMjYtMTAtMDFUMDA6MDA6MDBaIiwKICAic3RhdGVfc2NoZW1hIjogMywKICAiY29tcGF0IjogewogICAgImJhY2tlbmRzIjogWyJjb21wb3NlIl0KICB9LAogICJzaWduaW5nX2tleV9pZCI6ICJyZWwtMjAyNi1hIiwKICAibm90ZXMiOiAiU29sYXJtYW4tTGVzZXBmYWQgZ2VoYWVydGV0OyBrZWluZSAvZGF0YS1NaWdyYXRpb24uIgp9Cg==",
  "signature_b64": "ewogICJzY2hlbWFfdmVyc2lvbiI6ICIxLjAiLAogICJhbGciOiAiZWQyNTUxOSIsCiAgImtleV9pZCI6ICJyZWwtMjAyNi1hIiwKICAiZG9tYWluIjogInJlbGVhc2UiLAogICJzaWduYXR1cmUiOiAiQUFBQUFBQUFBQUFBQUFBQUFBQUFBQUFBQUFBQUFBQUFBQUFBQUFBQUFBQUFBQUFBQUFBQUFBQUFBQUFBQUFBQUFBQUFBQUFBQUFBQUFBQUFBQUFBQUE9PSIKfQo="
}
